{
  "checks": [
    {
      "name": "ai-team-run-schema",
      "status": "passed",
      "details": "npm run ai:validate -- --run-id 2026-07-11T02-37-12.961Z_theme-profile-refresh passed for run, plan, memory, design, and build artifacts before verify/review artifacts were written."
    },
    {
      "name": "changed-design-json-parse",
      "status": "passed",
      "details": "Parsed aesthetic-profile.json, allowed-patterns.json, banned-patterns.json, design-review-rubric.json, and dsl/design-spec.template.json with JSON.parse successfully."
    },
    {
      "name": "stale-profile-language-search",
      "status": "passed",
      "details": "Search found no active old-profile language under specs/design-rule-engine except the intentional note in aesthetic-profile.json stating that the old warm restrained profile set has been discarded."
    },
    {
      "name": "eslint",
      "status": "passed",
      "details": "npm run lint exited 0. It reported 8 pre-existing unused-variable warnings in src files, with no errors."
    }
  ],
  "passed": true,
  "visual_checks": [
    {
      "name": "browser-verification",
      "status": "skipped",
      "details": "No rendered UI, CSS runtime token, or TSX component changed. Browser evidence is deferred to a future visual task that applies these profiles to runtime UI."
    }
  ],
  "blocking_issues": []
}
