{
  "checks": [
    {
      "name": "npm run lint",
      "status": "passed",
      "details": "ESLint exited 0 with 7 pre-existing unused-variable warnings in unrelated files and no errors."
    },
    {
      "name": "npm run build",
      "status": "passed",
      "details": "Next.js 16.0.10 production build compiled, typechecked, and generated static pages successfully. The printed route table contains /, /music-fonts, /songs, /songs/[songId], and /voicings, with no /quiz or /chords route."
    },
    {
      "name": "Production route manifest",
      "status": "passed",
      "details": ".next/server/app-paths-manifest.json contains no /quiz or /chords entry."
    },
    {
      "name": "Runtime source references",
      "status": "passed",
      "details": "Targeted source searches found no navigation links to /quiz or /chords, no removed page.tsx files, and no IntervalQuiz or PlayButton runtime references."
    },
    {
      "name": "git diff --check",
      "status": "passed",
      "details": "Git reported no whitespace errors."
    },
    {
      "name": "React best-practices review",
      "status": "passed",
      "details": "The remaining TSX edit only removes two static navigation entries and introduces no component, hook, accessibility, performance, or TypeScript regression."
    }
  ],
  "passed": true,
  "visual_checks": [
    {
      "name": "Before primary navigation evidence",
      "status": "passed",
      "details": "Before screenshot .ai/runs/2026-07-23T16-47-54.798Z_remove-quiz-chords-pages/evidence/before-home.png and browser snapshot showed Canvas, Chords, Voicings, Quiz, Songs, and Score Lab."
    },
    {
      "name": "After desktop primary navigation",
      "status": "passed",
      "details": "After screenshot .ai/runs/2026-07-23T16-47-54.798Z_remove-quiz-chords-pages/evidence/after-home-desktop.png and browser snapshot showed exactly Canvas, Voicings, Songs, and Score Lab. The page had meaningful content, no framework error overlay, and document scrollWidth equaled clientWidth at 1280px."
    },
    {
      "name": "After mobile primary navigation",
      "status": "passed",
      "details": "After screenshot .ai/runs/2026-07-23T16-47-54.798Z_remove-quiz-chords-pages/evidence/after-home-mobile.png showed the same four remaining links at 390px. document scrollWidth equaled clientWidth, so the reduced navigation introduced no avoidable horizontal overflow."
    },
    {
      "name": "Removed route behavior",
      "status": "passed",
      "details": "Browser checks and direct HTTP requests confirmed /quiz and /chords each return the normal 404 page with no framework error overlay."
    },
    {
      "name": "Representative navigation and redundant-label check",
      "status": "passed",
      "details": "The shared navigation retains the four supported destinations in their prior relative order, with no replacement label, duplicate local context, or stale removed-route entry."
    },
    {
      "name": "Served CSS semantic class check",
      "status": "skipped",
      "details": "No CSS rules, reusable semantic classes, styling tokens, or theme infrastructure changed."
    }
  ],
  "blocking_issues": []
}
