{
  "checks": [
    {
      "name": "skill structure validation",
      "status": "passed",
      "details": "quick_validate.py accepted skills/audio-to-score, including the new one-level publication-handoff reference."
    },
    {
      "name": "final-score validator tests",
      "status": "passed",
      "details": "python3 -m unittest test_validate_score.py passed all 10 tests."
    },
    {
      "name": "skill synchronization tests",
      "status": "passed",
      "details": "npm run test:skill-sync passed all 3 install, drift-repair, and target-safety tests."
    },
    {
      "name": "installed skill drift check",
      "status": "passed",
      "details": "Repository and installed audio-to-score hashes both equal 5a3603c4cc099472e0ce8053415860174990761ee7e020ede91b249f8604735e and the receipt matches."
    },
    {
      "name": "lint",
      "status": "passed",
      "details": "npm run lint exited 0 with 7 pre-existing unrelated unused-symbol warnings and no errors."
    },
    {
      "name": "production build",
      "status": "passed",
      "details": "npm run build compiled, typechecked, and generated all static routes successfully."
    },
    {
      "name": "diff hygiene",
      "status": "passed",
      "details": "git diff --check passed."
    }
  ],
  "passed": true,
  "visual_checks": [
    {
      "name": "rendered UI verification",
      "status": "skipped",
      "details": "This refinement changes only skill instructions, artifact contracts, verification guidance, and run records; no rendered product surface changed."
    }
  ],
  "blocking_issues": []
}
