{
  "checks": [
    {
      "name": "Prettier",
      "status": "passed",
      "details": "The changed TSX file matches repository formatting."
    },
    {
      "name": "ESLint",
      "status": "passed",
      "details": "npm run lint completed with zero errors; seven pre-existing unrelated unused-variable warnings remain."
    },
    {
      "name": "TypeScript",
      "status": "passed",
      "details": "npx tsc --noEmit completed successfully."
    },
    {
      "name": "Production build",
      "status": "passed",
      "details": "npm run build completed and statically generated all song routes."
    },
    {
      "name": "React and Next.js review",
      "status": "passed",
      "details": "The existing client boundary and effect cleanup remain intact; the refinement adds no hooks, state, components, dependencies, or server/client boundary changes."
    },
    {
      "name": "Scoped changes",
      "status": "passed",
      "details": "Product-code changes remain confined to lead-sheet-renderer.tsx; song data, alphaTex generation, CSS, and dependencies are unchanged."
    }
  ],
  "passed": true,
  "visual_checks": [
    {
      "name": "Four-iteration evidence",
      "status": "passed",
      "details": "Evidence captures the rejected centered-anchor experiment, three-measure 78% super treatment, lowered 28% treatment, and accepted three-measure 80%/38% treatment."
    },
    {
      "name": "Perceptual chord separation at 390px",
      "status": "passed",
      "details": "The densest representative gap increased from 0.6px to 13.8px; A♭△7/G−7 and E♭△7/A♭△7 are visibly distinct chord groups."
    },
    {
      "name": "Modifier legibility and attachment",
      "status": "passed",
      "details": "Raised parts increased from 9.576px to 10.944px and their rise decreased from about 9.7px to 3.6px, keeping ♭9, ♯9, and sus4 readable and visually attached to their chord."
    },
    {
      "name": "Notation semantics",
      "status": "passed",
      "details": "Fresh-render DOM inspection confirms C△7, G−7, baseline E−7/B♭, raised C7♭9, and raised E7♯9."
    },
    {
      "name": "Available-width fit and redundant labels",
      "status": "passed",
      "details": "At 390px inner, client, and scroll widths all equal 390px; representative systems are fully visible and no new labels or chrome were introduced."
    },
    {
      "name": "Desktop regression",
      "status": "passed",
      "details": "At 1280px the page loads without an error overlay, has no horizontal overflow, and retains the four-measure desktop setting."
    },
    {
      "name": "Dev-server integrity",
      "status": "passed",
      "details": "agent-browser verification found meaningful content and no Next.js error overlay after the final implementation."
    }
  ],
  "blocking_issues": []
}
