{
  "checks": [
    {
      "name": "eslint",
      "status": "passed",
      "details": "npm run lint completed without errors. The repo still has unrelated pre-existing warnings for unused symbols in canvas, chords, tracker, caged, and chord-playback files."
    },
    {
      "name": "run-schema-validation",
      "status": "passed",
      "details": "npm run ai:validate -- --run-id 2026-03-14T08-39-24.566Z_design-token-foundation"
    }
  ],
  "passed": true,
  "visual_checks": [
    {
      "name": "token-baseline-consistency",
      "status": "passed",
      "details": "The draft token values in specs/design-rule-engine/design-tokens.template.json match the CSS variable bindings added in src/app/globals.css for typography, spacing, and color roles."
    }
  ],
  "blocking_issues": []
}
