{
  "checks": [
    {
      "name": "npm run build",
      "status": "passed",
      "details": "Optimized production build succeeds; /practice statically generated"
    },
    {
      "name": "npm run lint",
      "status": "passed",
      "details": "Exit0; seven pre-existing unused-variable warnings outside changed files, no errors; changed files focused ESLint clean"
    },
    {
      "name": "npx tsc --noEmit",
      "status": "passed",
      "details": "Exit0"
    },
    {
      "name": "Timing boundary tests",
      "status": "passed",
      "details": "3 node tests covering all transitions, beats22/30, loopwrap and repeated periods"
    },
    {
      "name": "Existing tests",
      "status": "passed",
      "details": "song-alphatex1/1 and skill-sync3/3 passed"
    },
    {
      "name": "Actual audio delivery",
      "status": "passed",
      "details": "WAV stereoPCM16 48000Hz1355294frames28.235292s; HTTP200 and Range206. Original decoded source differs in only16samples at final14frames, maximum1LSB"
    },
    {
      "name": "Media flow and recovery",
      "status": "passed",
      "details": "Actual playback, native looping, ten observed chord regions, pause/resume, error/retry, and existing Songs navigation checked in browser; browser-evidence.json"
    },
    {
      "name": "git diff --check",
      "status": "passed",
      "details": "Exit0"
    }
  ],
  "visual_checks": [
    {
      "name": "Before/after screenshots",
      "status": "passed",
      "details": "Before production Songs desktop/320; after /practice320/390 captures in conversation, referenced by browser-evidence.json"
    },
    {
      "name": "Representative rows, redundancy and fit",
      "status": "passed",
      "details": "Row3 long scale + halfbars fit; docscroll=client320/390, no clipping, 16px chord font. Primary bottom649 at320. Labels not repeated."
    },
    {
      "name": "Served styling",
      "status": "passed",
      "details": "No new reusable semantic CSS classes or global variables; existing Tailwind utilities visibly render dark primary selection on active region, thin bar borders, equal chart subdivisions."
    }
  ],
  "passed": true,
  "blocking_issues": []
}
