{
  "checks": [
    {
      "name": "typescript",
      "status": "passed",
      "details": "source \"$HOME/.nvm/nvm.sh\" && npx tsc --noEmit"
    },
    {
      "name": "lint",
      "status": "passed",
      "details": "source \"$HOME/.nvm/nvm.sh\" && npm run lint completed with only pre-existing warnings outside packages/music-analysis."
    },
    {
      "name": "audio-mir-short-clip",
      "status": "passed",
      "details": "A 20-second clip derived from the provided mp3 completed preprocess, Demucs separation, rhythm, harmony, smoothing, and aggregation with 9 bars and 4 final chord spans."
    }
  ],
  "passed": true,
  "visual_checks": [
    {
      "name": "ui-scope",
      "status": "skipped",
      "details": "No rendered UI changed in this refinement."
    }
  ],
  "blocking_issues": []
}
