{
  "checks": [
    {
      "name": "audio chord recognition unit tests",
      "status": "passed",
      "details": "22 tests passed, including the four code-review refinement cases."
    },
    {
      "name": "skill package validation",
      "status": "passed",
      "details": "skill-creator quick_validate reported Skill is valid."
    },
    {
      "name": "installed skill synchronization",
      "status": "passed",
      "details": "Repository and installed skill hashes both equal e932861e0f1b32be930fe0e0e336fce6c90077e948dc1cb2b7202e16a29746d9; receipt matches."
    },
    {
      "name": "skill synchronization regression tests",
      "status": "passed",
      "details": "3 Node synchronization tests passed."
    },
    {
      "name": "supplied recording evidence extraction",
      "status": "passed",
      "details": "Current code produced evidence_ready with 124 segments, 124 non-authoritative recurrence descriptors, 69.837 and 139.675 BPM hypotheses, and multiple keys including C minor and E-flat major."
    },
    {
      "name": "measurement and judgment boundary",
      "status": "passed",
      "details": "Every tempo/grid requires agent selection, every recurrence descriptor requires agent interpretation, every chord segment forbids automatic selection and retains alternatives, and recursive key inspection found no final-decision or confidence fields."
    },
    {
      "name": "mismatched source duration",
      "status": "passed",
      "details": "A 20-second full mix and 19.5-second harmonic stem produced and validated 12 segments without frame-mask mismatch."
    },
    {
      "name": "partial evidence and preprocessing failures",
      "status": "passed",
      "details": "Tests confirm partial_evidence remains valid for weak rhythm while evidence_ready stays strict; invalid explicit binaries and ffmpeg failures return actionable errors."
    },
    {
      "name": "repository diff integrity",
      "status": "passed",
      "details": "git diff --check and Python compilation passed."
    },
    {
      "name": "web build and lint",
      "status": "skipped",
      "details": "No application JavaScript, TypeScript, CSS, or rendered UI changed."
    }
  ],
  "passed": true,
  "visual_checks": [
    {
      "name": "rendered UI verification",
      "status": "skipped",
      "details": "Not applicable to a non-visual skill, Python script, contract, and test change."
    }
  ],
  "blocking_issues": []
}
